product_name,gender,color,sleeve_type,material,combo_item,price,no._of_sells,no._of_review,location,product_link,product_id,sku,discount,price_band,discount_band,sales_per_review
à¦ªà§à¦°à§à¦·à¦¦à§‡à¦° à¦œà¦¨à§à¦¯ à¦•à§à¦¯à¦¾à¦œà§à¦¯à¦¼à¦¾à¦² à¦Ÿà¦¿-à¦¶à¦¾à¦°à§à¦Ÿ - T-Shirt,Unknown,Unknown,Unknown,Unknown,Unknown,96,213,27,Dhaka,www.daraz.com.bd/products/-i206613678.html,206613678,206613678_BD-1155900133,52.0,Low,High,7.607142857142857
Half sleeve Chinese jercy micro fibr DTF printed tshirt for Men,Male,Unknown,Half Sleeve,Unknown,Unknown,89,90,12,Dhaka,www.daraz.com.bd/products/fibr-dtf-i318636206.html,318636206,318636206_BD-1453972411,56.0,Low,High,6.923076923076923
SMUG Premium Combo T-shirt and Trouser - Fabric soft and comfortable - Multi,Unknown,Unknown,Unknown,Unknown,Combo,685,2100,285,Dhaka,www.daraz.com.bd/products/smug-i303804567.html,303804567,303804567_BD-1646544707,47.0,Premium,Medium,7.3426573426573425
Black Short Sleeve -T-Shirt For Man Summer Collection,Male,Black,Short Sleeve,Unknown,Unknown,150,10,1,Dhaka,www.daraz.com.bd/products/-i328491219.html,328491219,328491219_BD-1602875668,50.0,Medium,Medium,5.0
Mash Fabrics Men's T-shirt for Summer - Half Sleeve Round Neck T Shirt For Men - Comfortable to Wear in Summer Season,Male,Unknown,Half Sleeve,Unknown,Unknown,228,481,47,Rajshahi,www.daraz.com.bd/products/-i323349963.html,323349963,323349963_BD-1543975412,67.0,High,Very High,10.020833333333334
Fashion 2024 New High-Quality Half Sleeve T-Shirt for Men - Stay Ahead in Fashion with This Latest Collection That Defines Comfort,Male,Unknown,Half Sleeve,Unknown,Unknown,96,9,1,Dhaka,www.daraz.com.bd/products/2024-i340262888.html,340262888,340262888_BD-1666406804,3.0,Low,Low,4.5
Halfsleeve Chines microfibre jersy printed thin tshirt for women and girls,Female,Unknown,Unknown,Unknown,Unknown,99,1200,106,Dhaka,www.daraz.com.bd/products/-i318670647.html,318670647,318670647_BD-1454294197,60.0,Low,Very High,11.214953271028037
Premium Quality - 2023 New Excellent T-shirts Of Good Quality men's half-sleeved T-shirts - Trend and Need full - Iconic Style,Unknown,Unknown,Unknown,Unknown,Unknown,88,185,25,Dhaka,www.daraz.com.bd/products/-i384367636.html,384367636,384367636_BD-1922267096,56.0,Low,High,7.115384615384615
Combo SET - Black T-Shirt And Trouser for Men -special edition,Male,Black,Unknown,Unknown,Combo,447,1100,124,Dhaka,www.daraz.com.bd/products/-i339659840.html,339659840,339659840_BD-1663974024,53.0,Premium,High,8.8
Olive Cotton and Polyester Short Sleeve T-Shirt for Men - T Shirt - T Shirt For Man Qualityful - Easy To care and Longive,Male,Unknown,Short Sleeve,Cotton,Unknown,160,12200,1240,Dhaka,www.daraz.com.bd/products/olive-cotton-and-polyester-short-sleeve-t-shirt-for-men-t-shirt-t-shirt-for-man-qualityful-easy-to-care-and-longive-i136954564.html,136954564,136954564_BD-1059260216,20.0,Medium,Low,9.830781627719581
Fashion Ladies Short Sleeve Casual Girl Print New Jersey Fabric T-Shirt  [ Cat Ball ],Female,Unknown,Short Sleeve,Unknown,Unknown,199,449,48,Dhaka,www.daraz.com.bd/products/-i343869444.html,343869444,343869444_BD-1677231813,64.0,High,Very High,9.16326530612245
Premium Quality - stylish new T Shirt - Casual Exclusive half Sleeve T Shirt For Men - T Shirt,Male,Unknown,Half Sleeve,Unknown,Unknown,95,74,4,Dhaka,www.daraz.com.bd/products/-i324194071.html,324194071,324194071_BD-1551964993,50.0,Low,Medium,14.8
2 pse combbo tshirt for men and women,Male,Unknown,Unknown,Unknown,Unknown,198,353,34,Dhaka,www.daraz.com.bd/products/2-i358635513.html,358635513,358635513_BD-1769107582,51.0,High,High,10.085714285714285
Map Out Your Style Journey with Bangladesh Map T-Shirt for Man - Round Neck Casual Wear for Geo-Chic Fashion,Male,Unknown,Unknown,Unknown,Unknown,287,378,58,Dhaka,www.daraz.com.bd/products/map-out-your-style-journey-with-bangladesh-map-t-shirt-for-man-round-neck-casual-wear-for-geo-chic-fashion-i137010141.html,137010141,137010141_BD-1059320197,48.0,Premium,Medium,6.406779661016949
SMUG Stylish T-shirt Comfortable - New Contrast Design,Unknown,Unknown,Unknown,Unknown,Unknown,250,2800,365,Dhaka,www.daraz.com.bd/products/smug-i282833379.html,282833379,282833379_BD-1272650229,58.0,High,Very High,7.6502732240437155
Black Cotton Combo T-Shirt & Trouser Pant For Man-Black T-Shirt And Pant For Men - T Shirt,Male,Black,Unknown,Cotton,Combo,437,793,67,Dhaka,www.daraz.com.bd/products/black-cotton-combo-t-shirt-trouser-pant-for-man-black-t-shirt-and-pant-for-men-t-shirt-i299439208.html,299439208,299439208_BD-1329929894,27.0,Premium,Low,11.661764705882353
Export Quality T-Shirt Fabric Soft And Comfortable - T Shirt,Unknown,Unknown,Unknown,Unknown,Unknown,300,308,30,Dhaka,www.daraz.com.bd/products/export-quality-t-shirt-fabric-soft-and-comfortable-t-shirt-i291454765.html,291454765,291454765_BD-1296439827,0.0,Premium,Low,9.935483870967742
Stylish Long Sleeve T-Shit For Men- - T Shirt For Man - T Shirt,Male,Unknown,Unknown,Unknown,Unknown,190,441,51,Dhaka,www.daraz.com.bd/products/stylish-long-sleeve-t-shit-for-men-t-shirt-for-man-t-shirt-i191308218.html,191308218,191308218_BD-1138395370,68.0,High,Very High,8.48076923076923
Men's Black & White Comfortable Full Sleeve & Round Neck T-Shirt - Custom Fit,Unknown,Black & White,Full Sleeve,Unknown,Unknown,182,8700,969,Dhaka,www.daraz.com.bd/products/mens-black-white-comfortable-full-sleeve-round-neck-t-shirt-custom-fit-i158130711.html,158130711,158130711_BD-1089440639,82.0,High,Very High,8.969072164948454
Best Quality Casual à¦—à§‡à¦žà§à¦œà¦¿ à¦›à§‡à¦²à§‡à¦¦à§‡à¦° new tshirt | Half Sleeve genji for man,Male,Unknown,Half Sleeve,Unknown,Unknown,99,29,7,Dhaka,www.daraz.com.bd/products/-i410079191.html,410079191,410079191_BD-2027453819,50.0,Low,Medium,3.625
Treee New Stylish Casual T-Shirt for men,Male,Unknown,Unknown,Unknown,Unknown,99,55,1,Dhaka,www.daraz.com.bd/products/treee-i356139532.html,356139532,356139532_BD-1753990529,50.0,Low,Medium,27.5
"Stay Stylish with Fashion Tops - Ladies  Short Sleeve Casual Girls' Print T-Shirt - Very Comfortable and Fashionable, Easy to Clean.",Female,Unknown,Short Sleeve,Unknown,Unknown,128,8300,1275,Rangpur,www.daraz.com.bd/products/stay-stylish-with-fashion-tops-ladies-short-sleeve-casual-girls-print-t-shirt-very-comfortable-and-fashionable-easy-to-clean-i128790738.html,128790738,128790738_BD-1048618057,49.0,Medium,Medium,6.504702194357367
High Quality Cotton&Polyester T-shirt & 2 Quarter Pants For Man - T-Shirt - T Shirt - T Shirt For Man - T Shirt - à¦—à§‡à¦žà§à¦œà¦¿ à¦›à§‡à¦²à§‡à¦¦à§‡à¦°,Male,Unknown,Unknown,Cotton & Polyester,Unknown,356,786,72,Dhaka,www.daraz.com.bd/products/2-i191917457.html,191917457,191917457_BD-1138822432,46.0,Premium,Medium,10.767123287671232
Premium Quality Half Pant & T-shirt Set,Unknown,Unknown,Unknown,Unknown,Unknown,285,0,0,Dhaka,www.daraz.com.bd/products/-i346929347.html,346929347,346929347_BD-1696496939,59.0,Premium,Very High,0.0
BTS All Member's Menz & Women's Round Neck Half Sleeve Tshirt - Tshirt,Unknown,Unknown,Half Sleeve,Unknown,Unknown,115,211,18,Dhaka,www.daraz.com.bd/products/bts-all-members-menz-womens-round-neck-half-sleeve-tshirt-tshirt-i230559090.html,230559090,230559090_BD-1173971469,59.0,Medium,Very High,11.105263157894736
Gremlins t shirt women anime streetwear comic t shirt female designer clothes,Female,Unknown,Unknown,Unknown,Unknown,857,16,0,Overseas,www.daraz.com.bd/products/-i412218904.html,412218904,412218904_BD-2039541083,68.0,Premium,Very High,16.0
ZORO T-SHIRT BY BANGA KUN SHOP One Piece Anime T-shirt Roronoa Zoro Black Cotton Premium Anime Cotton Half T-shirt made in Bangladesh,Unknown,Black,Unknown,Cotton,Unknown,379,191,28,Dhaka,www.daraz.com.bd/products/zoro-t-shirt-by-banga-kun-shop-one-piece-anime-t-shirt-roronoa-zoro-black-cotton-premium-anime-cotton-half-t-shirt-made-in-bangladesh-i295172373.html,295172373,295172373_BD-1475744099,16.0,Premium,Low,6.586206896551724
Yellow&White Cotton T-Shirt for Men,Male,Yellow,Unknown,Cotton,Unknown,157,3800,299,Dhaka,www.daraz.com.bd/products/-i171482958.html,171482958,171482958_BD-1107486141,47.0,Medium,Medium,12.666666666666666
BTS SYNTHETIC Tee Full HD Print Unisex T-Shirt - A Round Neck Casual Wear for Fans - Celebrating Your Love for the Band,Unknown,Unknown,Unknown,Unknown,Unknown,159,74,5,Dhaka,www.daraz.com.bd/products/bts-hd-i355990439.html,355990439,355990439_BD-1754345594,47.0,Medium,Medium,12.333333333333334
(Life Is A Beautiful Ride)Summer Cotton Halfsleeve Tshirt Mb307 - Tshirt For Men  - T Shirt For Man - T Shirt - T Shirt For Man,Male,Unknown,Unknown,Cotton,Unknown,295,362,86,Dhaka,www.daraz.com.bd/products/life-is-a-beautiful-ridesummer-cotton-halfsleeve-tshirt-mb307-tshirt-for-men-t-shirt-for-man-t-shirt-t-shirt-for-man-i225583668.html,225583668,225583668_BD-1170650688,30.0,Premium,Low,4.160919540229885
Half sleeve Chines microfibre jercy thin printed tshirt for women and girls,Female,Unknown,Half Sleeve,Unknown,Unknown,99,714,61,Dhaka,www.daraz.com.bd/products/-i328782208.html,328782208,328782208_BD-1603949606,60.0,Low,Very High,11.516129032258064
Premium Quality - stylish new T Shirt - Casual Exclusive half Sleeve T Shirt For Men - T Shirt,Male,Unknown,Half Sleeve,Unknown,Unknown,99,35,1,Dhaka,www.daraz.com.bd/products/-i324185865.html,324185865,324185865_BD-1551971277,48.0,Low,Medium,17.5
Best Quality Casual T-shirt's for men,Male,Unknown,Unknown,Unknown,Unknown,89,17,2,Dhaka,www.daraz.com.bd/products/-i326045902.html,326045902,326045902_BD-1570412256,11.0,Low,Low,5.666666666666667
Chinese Design Short Hata Gol Gola Excellent Tshirt For Men,Male,Unknown,Unknown,Unknown,Unknown,115,11,0,Dhaka,www.daraz.com.bd/products/-i297615598.html,297615598,297615598_BD-1318697797,56.0,Medium,High,11.0
Casual Style with Black Full Sleeve Cotton T-Shirt for Men - Classic Round Neck Design for Comfort and Fashion,Male,Black,Full Sleeve,Cotton,Unknown,191,177,16,Dhaka,www.daraz.com.bd/products/casual-style-with-black-full-sleeve-cotton-t-shirt-for-men-classic-round-neck-design-for-comfort-and-fashion-i275154045.html,275154045,275154045_BD-1252601938,63.0,High,Very High,10.411764705882353
Whimsical Understated -Craftsmanship and Trendy -Stream Rap T Shirt For Man Ii Printed Casual T Shirt,Male,Unknown,Unknown,Unknown,Unknown,96,11,2,Dhaka,www.daraz.com.bd/products/whimsical-ii-i367083003.html,367083003,367083003_BD-1829890670,52.0,Low,High,3.6666666666666665
Men's Slim Fit Solid Color T-Shirt  - T Shirt - T Shirt For Man,Male,Unknown,Unknown,Unknown,Unknown,99,675,120,Dhaka,www.daraz.com.bd/products/-i125895884.html,125895884,125895884_BD-1046021720,78.0,Low,Very High,5.578512396694215
Best Quality White & Black T-shirt Casual T-Shirt for Men - Showcase Unique Style in Your Casual and Stylish Fashion,Male,Black,Unknown,Unknown,Unknown,370,9,0,Dhaka,www.daraz.com.bd/products/-i363592742.html,363592742,363592742_BD-1796602040,0.0,Premium,Low,9.0
tylish Quality Cotton Full Sleeve T-Shirt For Men - A Wardrobe Staple Suitable for All Seasons - Perfect Casual Wear for Quality and Style Every Day,Male,Unknown,Full Sleeve,Cotton,Unknown,195,3400,253,Dhaka,www.daraz.com.bd/products/tylish-quality-cotton-full-sleeve-t-shirt-for-men-a-wardrobe-staple-suitable-for-all-seasons-perfect-casual-wear-for-quality-and-style-every-day-i191322551.html,191322551,191322551_BD-1138406179,61.0,High,Very High,13.385826771653543
Stylish Ladies cotton half sleeve t shirt for women Fashion-Coffe,Female,Unknown,Half Sleeve,Cotton,Unknown,180,2500,329,Dhaka,www.daraz.com.bd/products/-i235289088.html,235289088,235289088_BD-1178516247,64.0,High,Very High,7.575757575757576
Black Cotton Combo T-Shirt & trouser Pant For Man-Black T-shirt and Pant for men,Male,Black,Unknown,Cotton,Combo,396,458,84,Dhaka,www.daraz.com.bd/products/black-cotton-combo-t-shirt-trouser-pant-for-man-black-t-shirt-and-pant-for-men-i299427784.html,299427784,299427784_BD-1329899817,34.0,Premium,Low,5.3882352941176475
BLACK COLOUR LONG SLEEVE CASUAL T-SHART FOR MEN .,Male,Black,Unknown,Unknown,Unknown,170,1500,149,Dhaka,www.daraz.com.bd/products/t-shart-i299565654.html,299565654,299565654_BD-1330557225,39.0,Medium,Medium,10.0
Exclusive half Sleeve T Shirt For Men - T Shirt,Male,Unknown,Half Sleeve,Unknown,Unknown,95,22,2,Dhaka,www.daraz.com.bd/products/elevate-your-casual-wardrobe-with-the-new-trendy-stylish-men-round-neck-jersey-t-shirt-for-man-stay-fashionable-i346016090.html,346016090,346016090_BD-1693084289,62.0,Low,Very High,7.333333333333333
Menz Full Sleeve Tshirt - T Shirt,Unknown,Unknown,Full Sleeve,Unknown,Unknown,125,519,54,Dhaka,www.daraz.com.bd/products/menz-full-sleeve-tshirt-t-shirt-i217079265.html,217079265,217079265_BD-1165179631,44.0,Medium,Medium,9.436363636363636
White-Black Cotton Combo T-Shirts & Pants for Men - Stylish Matching Sets - Easy to Use And Maintain - Comfortable T-Shirts and Pants Ensembles,Male,Black,Unknown,Cotton,Combo,237,669,47,Dhaka,www.daraz.com.bd/products/white-black-cotton-combo-t-shirts-pants-for-men-stylish-matching-sets-easy-to-use-and-maintain-comfortable-t-shirts-and-pants-ensembles-i300166679.html,300166679,300166679_BD-1333912537,41.0,High,Medium,13.9375
White And Black V Neck Full Sleeve Tshirt For Men - T Shirt For Man - T Shirt For Man - T Shirt - à¦—à§‡à¦žà§à¦œà¦¿ à¦›à§‡à¦²à§‡à¦¦à§‡à¦° - T Shirt,Male,Black,Full Sleeve,Unknown,Unknown,190,371,35,Dhaka,www.daraz.com.bd/products/white-and-black-v-neck-full-sleeve-tshirt-for-men-t-shirt-for-man-t-shirt-for-man-t-shirt-t-shirt-i201910286.html,201910286,201910286_BD-1149438393,66.0,High,Very High,10.305555555555555
Ladies Short Sleeve Cotton T-Shirt,Female,Unknown,Short Sleeve,Cotton,Unknown,154,24,5,Dhaka,www.daraz.com.bd/products/-i323337438.html,323337438,323337438_BD-1540296870,62.0,Medium,Very High,4.0
Men New Fashionable New Design Digital Printed Boys T-Shirt For Men - A Casual Round Neck Choice for Trendy Comfort,Male,Unknown,Unknown,Unknown,Unknown,96,0,1,Dhaka,www.daraz.com.bd/products/-i344119704.html,344119704,344119704_BD-1678519981,52.0,Low,High,0.0
Black Combo T-Shirts & Pants for Men,Male,Black,Unknown,Unknown,Combo,290,0,1,Dhaka,www.daraz.com.bd/products/-i344001892.html,344001892,344001892_BD-1678249192,42.0,Premium,Medium,0.0
MEN'S COTTON T-SHIRT WEED EGGO FRIENDLY BLACK VERSION,Unknown,Black,Unknown,Cotton,Unknown,342,6,0,Dhaka,www.daraz.com.bd/products/eggo-i323073532.html,323073532,323073532_BD-1534069065,30.0,Premium,Low,6.0
Best Quality Casual T-shirt's for men,Male,Unknown,Unknown,Unknown,Unknown,89,14,0,Dhaka,www.daraz.com.bd/products/-i323496983.html,323496983,323496983_BD-1541189633,56.0,Low,High,14.0
Navy Blue Premium Quality Full Sleeve T-Shirt for Men - Round Neck Ideal for All Seasons,Male,Blue,Full Sleeve,Unknown,Unknown,211,65,8,Dhaka,www.daraz.com.bd/products/navy-blue-premium-quality-full-sleeve-t-shirt-for-men-round-neck-ideal-for-all-seasons-i325174149.html,325174149,325174149_BD-1559472352,65.0,High,Very High,7.222222222222222
Off on Branded Half Sleeve T-shirt for Men | ID: 20942463918,Male,Unknown,Half Sleeve,Unknown,Unknown,89,17,5,Dhaka,www.daraz.com.bd/products/20942463918-i383988466.html,383988466,383988466_BD-1921540258,55.0,Low,High,2.8333333333333335
Anime T-shirt Jujutsu Kaisen Gojo Black Cotton Tshirt Satoru Gojo BACK AND FRONT Fashion 2 Side Premium Quality Men,Male,Black,Unknown,Cotton,Unknown,380,844,170,Dhaka,www.daraz.com.bd/products/jujutsu-kaisen-gojo-satoru-gojo-2-i253823374.html,253823374,253823374_BD-1199525137,0.0,Premium,Low,4.935672514619883
Nosto Chatro most premium Black color Drop ShoulderÂ t-shirt!,Unknown,Black,Unknown,Unknown,Unknown,450,0,0,Dhaka,www.daraz.com.bd/products/nosto-chatro-i387945935.html,387945935,387945935_BD-1934977011,55.0,Premium,High,0.0
Black All print Summer Combo T-Shirt & Pant for Boy,Male,Black,Unknown,Unknown,Combo,280,19,0,Dhaka,www.daraz.com.bd/products/-i347630174.html,347630174,347630174_BD-1700430673,49.0,Premium,Medium,19.0
Black Combo Set Half Sleeve T-Shirt & Quarter Pant For Men - T Shirt & Summer Pant For Boys,Male,Black,Half Sleeve,Unknown,Combo,276,28,2,Dhaka,www.daraz.com.bd/products/-i324223230.html,324223230,324223230_BD-1552094885,45.0,Premium,Medium,9.333333333333334
White Printed Summer Combo T-Shirt & Pant for Men - Elevate Your Summer Style with This Trendy Combo - Perfect For All Season,Male,White,Unknown,Unknown,Combo,399,1800,130,Dhaka,www.daraz.com.bd/products/white-printed-summer-combo-t-shirt-pant-for-men-elevate-your-summer-style-with-this-trendy-combo-perfect-for-all-season-i231674151.html,231674151,231674151_BD-1174797254,27.0,Premium,Low,13.740458015267176
Summer White Printed Combo Set Half Sleeve T-Shirt & Quarter Pant For Men - T Shirt & Pant For Boys,Male,White,Half Sleeve,Unknown,Combo,375,156,6,Dhaka,www.daraz.com.bd/products/-i347647083.html,347647083,347647083_BD-1700635104,37.0,Premium,Low,22.285714285714285
Superlative Versatile -Choice and Remark -High Quality T-shirt & 2 Quarter Pants For Man - T Shirt - T Shirt For Man,Male,Unknown,Unknown,Unknown,Unknown,287,70,16,Dhaka,www.daraz.com.bd/products/2-i337952568.html,337952568,337952568_BD-1650031443,18.0,Premium,Low,4.117647058823529
Ladies Long Sleeve Crop Top - T Shirt For Women,Female,Unknown,Unknown,Unknown,Unknown,199,184,29,Dhaka,www.daraz.com.bd/products/ladies-long-sleeve-crop-top-t-shirt-for-women-i283547110.html,283547110,283547110_BD-2049506784,50.0,High,Medium,6.133333333333334
Black full  Sleeve T Shirt For Men - T Shirt,Male,Black,Unknown,Unknown,Unknown,240,0,3,Dhaka,www.daraz.com.bd/products/-i324577821.html,324577821,324577821_BD-1553391362,47.0,High,Medium,0.0
T-gallery Casual T-Shirts Half Sleeve,Unknown,Unknown,Half Sleeve,Unknown,Unknown,70,6,1,Dhaka,www.daraz.com.bd/products/-i321279293.html,321279293,321279293_BD-2017179715,30.0,Low,Low,3.0
High Quality Black Cotton T-shirt & 2 Quarter Pants For Man - T Shirt For Man - T Shirt For Man,Male,Black,Unknown,Cotton,Unknown,249,5700,434,Dhaka,www.daraz.com.bd/products/high-quality-black-cotton-t-shirt-2-quarter-pants-for-man-t-shirt-for-man-t-shirt-for-man-i191924239.html,191924239,191924239_BD-1138829212,55.0,High,High,13.10344827586207
Premium Quality - Exclusive Jersy half Sleeve T Shirt For Men - T Shirt - Modern - Choice Expression - Designed - Urban Vibes,Male,Unknown,Half Sleeve,Unknown,Unknown,99,16,4,Dhaka,www.daraz.com.bd/products/-i382628861.html,382628861,382628861_BD-1916018851,50.0,Low,Medium,3.2
Antik Mahmud Inverse Tshirt Black and White,Unknown,Black,Unknown,Unknown,Unknown,575,129,17,Dhaka,www.daraz.com.bd/products/-i323458799.html,323458799,323458799_BD-1541087679,4.0,Premium,Low,7.166666666666667
Half Sleeve Chinese Microfiber T-Shirts for Men - A Round Neck Casual and Comfortable Choice for All Seasons - Perfect Casual Wear,Male,Unknown,Half Sleeve,Unknown,Unknown,89,75,5,Dhaka,www.daraz.com.bd/products/half-sleeve-chinese-microfiber-t-shirts-for-men-a-round-neck-casual-and-comfortable-choice-for-all-seasons-perfect-casual-wear-i295937850.html,295937850,295937850_BD-1309329002,55.0,Low,High,12.5
Chainsaw Man Denji T-Shirt Black Cotton Large Printed T-shirt Anime T-shirt Comfortable Tees For Anime Fans Denji Chainsaw Man T-shirt Fashion,Male,Black,Unknown,Cotton,Unknown,500,330,72,Dhaka,www.daraz.com.bd/products/chainsaw-man-denji-t-shirt-black-cotton-large-printed-t-shirt-anime-t-shirt-comfortable-tees-for-anime-fans-denji-chainsaw-man-t-shirt-fashion-i280864025.html,280864025,280864025_BD-1268127736,0.0,Premium,Low,4.52054794520548
MEN'S COTTON T-SHIRT  MayaBi,Unknown,Unknown,Unknown,Cotton,Unknown,358,35,6,Dhaka,www.daraz.com.bd/products/-i337140908.html,337140908,337140908_BD-1643982646,24.0,Premium,Low,5.0
Mens Cotton T-shirt Ami Banglai Gan Gai,Unknown,Unknown,Unknown,Cotton,Unknown,358,0,1,Dhaka,www.daraz.com.bd/products/mens-cotton-t-shirt-pinkf-t-shirt-i313379339.html,313379339,313379339_BD-1405087534,38.0,Premium,Low,0.0
Relex New Comfortable casual T-shirt for men,Male,Unknown,Unknown,Unknown,Unknown,85,15,3,Dhaka,www.daraz.com.bd/products/-i343566972.html,343566972,343566972_BD-1675241616,60.0,Low,Very High,3.75
Best Quality Casual T-shirt's for men,Male,Unknown,Unknown,Unknown,Unknown,79,7,1,Dhaka,www.daraz.com.bd/products/-i326224434.html,326224434,326224434_BD-1573090186,61.0,Low,Very High,3.5
Half Sleeve Chinese Microfibre printed Tshirts for Women,Female,Unknown,Half Sleeve,Unknown,Unknown,99,141,17,Dhaka,www.daraz.com.bd/products/-i320109198.html,320109198,320109198_BD-1477752907,51.0,Low,High,7.833333333333333
Premium and Export Men's COTTON Half Sleeve T-shirt with Pure Comfort and sporty - T Shirt For Man - T Shirt For Man,Male,Unknown,Half Sleeve,Cotton,Unknown,457,62,10,Dhaka,www.daraz.com.bd/products/-i204848027.html,204848027,204848027_BD-1152994611,43.0,Premium,Medium,5.636363636363637
New T shirt - Fabric soft and comfortable to wear,Unknown,Unknown,Unknown,Unknown,Unknown,96,0,1,Dhaka,www.daraz.com.bd/products/-i340380443.html,340380443,340380443_BD-1668065569,49.0,Low,Medium,0.0
Best Quality Casual T-shirt's for men,Male,Unknown,Unknown,Unknown,Unknown,79,23,0,Dhaka,www.daraz.com.bd/products/-i325989691.html,325989691,325989691_BD-1570192539,61.0,Low,Very High,23.0
Folk'S Premium Men'S Blank T-Shirt - Dark Blue Color - Genji,Unknown,Blue,Unknown,Unknown,Unknown,690,0,1,Dhaka,www.daraz.com.bd/products/folks-premium-mens-blank-t-shirt-dark-blue-color-genji-i268823796.html,268823796,268823796_BD-1240896019,0.0,Premium,Low,0.0
High Quality Black Cotton T-shirt & 2 Quarter Pants For Man - T-Shirt - T Shirt For Man - T Shirt - T Shirt For Man,Male,Black,Unknown,Cotton,Unknown,251,504,41,Dhaka,www.daraz.com.bd/products/high-quality-black-cotton-t-shirt-2-quarter-pants-for-man-t-shirt-t-shirt-for-man-t-shirt-t-shirt-for-man-i230449938.html,230449938,230449938_BD-1173884147,69.0,High,Very High,12.0
"pera nai half Sleep T-shirt For Men,stylish premium T-Shirt for Men's",Unknown,Unknown,Unknown,Unknown,Unknown,96,9,1,Dhaka,www.daraz.com.bd/products/-i351466472.html,351466472,351466472_BD-1723767856,49.0,Low,Medium,4.5
New Casual T Shirt For Men/T Shirt For Men/ Mens T Shirt/ Genji,Unknown,Unknown,Unknown,Unknown,Unknown,95,21,6,Dhaka,www.daraz.com.bd/products/-i320978606.html,320978606,320978606_BD-1487015212,50.0,Low,Medium,3.0
Floral Alphabet Letters A To Z White Color T-Shirt For Men'S - T Shirt For Man,Male,White,Unknown,Unknown,Unknown,125,3600,242,Dhaka,www.daraz.com.bd/products/a-z-i230349223.html,230349223,230349223_BD-1173776308,52.0,Medium,High,14.814814814814815
Combo T-Shirt & trouser Pant For Man-Black T-shirt and Pant for men,Male,Black,Unknown,Unknown,Combo,437,5600,562,Dhaka,www.daraz.com.bd/products/combo-t-shirt-trouser-pant-for-man-black-t-shirt-and-pant-for-men-i299440138.html,299440138,299440138_BD-1329936001,27.0,Premium,Low,9.946714031971581
"SMUG Premium Contrast T-shirt COMBO - Fabric soft and comfortable - Deep Green, Black",Unknown,Green,Unknown,Unknown,Combo,568,89,15,Dhaka,www.daraz.com.bd/products/smug-i351834809.html,351834809,351834809_BD-1727051681,53.0,Premium,High,5.5625
Brawl stars Half Sleeve Round Neck Comfortable 100% premium cotton t-shirts - T Shirt For Man - T Shirt For Man - T Shirt For Man - T Shirt,Male,Unknown,Half Sleeve,Cotton,Unknown,265,17,3,Barishal,www.daraz.com.bd/products/brawl-stars-half-sleeve-round-neck-comfortable-100-premium-cotton-t-shirts-t-shirt-for-man-t-shirt-for-man-t-shirt-for-man-t-shirt-i269117775.html,269117775,269117775_BD-1241104518,45.0,High,Medium,4.25
T Shape Stylish Full Hata Tshirt - Genji - T Shirt For Man,Male,Unknown,Unknown,Unknown,Unknown,125,1300,124,Dhaka,www.daraz.com.bd/products/t-shape-stylish-full-hata-tshirt-genji-t-shirt-for-man-i217077681.html,217077681,217077681_BD-1165195060,43.0,Medium,Medium,10.4
tylish Unisex White And Ash Color Tshirts - Tshirt For Men,Male,White,Unknown,Unknown,Unknown,99,11,3,Dhaka,www.daraz.com.bd/products/-i405378243.html,405378243,405378243_BD-2009653891,50.0,Low,Medium,2.75
White printed Exclusive Summer Combo T-Shirt & Pant - T Shirt For Man,Male,White,Unknown,Unknown,Combo,243,18600,1485,Dhaka,www.daraz.com.bd/products/white-printed-exclusive-summer-combo-t-shirt-pant-t-shirt-for-man-i192044601.html,192044601,192044601_BD-1138892422,56.0,High,High,12.516823687752355
Alan Walker White T-Shirt - T Shirt For Man - T Shirt For Man - T Sirt - T Shirt,Male,White,Unknown,Unknown,Unknown,143,156,17,Dhaka,www.daraz.com.bd/products/-i107652833.html,107652833,107652833_BD-1022894863,72.0,Medium,Very High,8.666666666666666
Best Quality Men's Casual T-shirts - Half Sleeve Round Neck T Shirt For Men - Comfortable to Wear in Summer Season,Male,Unknown,Half Sleeve,Unknown,Unknown,89,333,20,Dhaka,www.daraz.com.bd/products/best-quality-mens-casual-t-shirts-half-sleeve-round-neck-t-shirt-for-men-comfortable-to-wear-in-summer-season-i313813954.html,313813954,313813954_BD-1407674794,70.0,Low,Very High,15.857142857142858
Best Quality Casual Solid T-shirt for men- t shirt,Unknown,Unknown,Unknown,Unknown,Unknown,90,9,0,Dhaka,www.daraz.com.bd/products/-i351504478.html,351504478,351504478_BD-1724222283,77.0,Low,Very High,9.0
V-Neck Black Cotton Long Sleeve Tshirt For Men - T Shirt For Man - T Shirt For Man - T Shirt For Man,Male,Black,Unknown,Cotton,Unknown,190,1200,150,Dhaka,www.daraz.com.bd/products/v-neck-black-cotton-long-sleeve-tshirt-for-men-t-shirt-for-man-t-shirt-for-man-t-shirt-for-man-i162828490.html,162828490,162828490_BD-1135818502,73.0,High,Very High,7.947019867549669
