product_name,gender,color,sleeve_type,material,combo_item,price,no._of_sells,no._of_review,location,product_link,product_id,sku,discount,price_band,discount_band,sales_per_review
Bolo Bir Chiro Unnoto Momo Shir Printed Casual T-Shirt//Tshirt For Men,Male,Unknown,Unknown,Unknown,Unknown,95,9,1,Dhaka,www.daraz.com.bd/products/-i410373538.html,410373538,410373538_BD-2028931388,52.0,Low,High,4.5
best High Quality half Sleeve t-shirt for Women and girls,Female,Unknown,Half Sleeve,Unknown,Unknown,96,0,0,Dhaka,www.daraz.com.bd/products/-i339191754.html,339191754,339191754_BD-1661806604,52.0,Low,High,0.0
Black Premium Quality Full Sleeve T-Shirt for Men,Male,Black,Full Sleeve,Unknown,Unknown,255,5,3,Dhaka,www.daraz.com.bd/products/-i325177210.html,325177210,325177210_BD-1559474838,57.0,High,High,1.25
Black Colour Half Sleeve T-Shirt for Men,Male,Black,Half Sleeve,Unknown,Unknown,150,7,2,Dhaka,www.daraz.com.bd/products/-i344318546.html,344318546,344318546_BD-1680315708,40.0,Medium,Medium,2.3333333333333335
Premium Stylish T-Shirt - Screen Print Comfortable and Soft Synthetic Fabrics for Men - Full Sleeve & Round Collar,Male,Unknown,Full Sleeve,Unknown,Unknown,237,646,63,Dhaka,www.daraz.com.bd/products/premium-stylish-t-shirt-screen-print-comfortable-and-soft-synthetic-fabrics-for-men-full-sleeve-round-collar-i324796626.html,324796626,324796626_BD-1555409496,41.0,High,Medium,10.09375
Tree Maroon Mens New Fashionable New Desing Digital printed T-shirt For Men,Male,Unknown,Unknown,Unknown,Unknown,107,145,13,Dhaka,www.daraz.com.bd/products/-i343178448.html,343178448,343178448_BD-1673341919,46.0,Medium,Medium,10.357142857142858
White Sleeveless T-Shirt And 2 Quarter Pant For Men,Male,White,Unknown,Unknown,Unknown,277,12,4,Dhaka,www.daraz.com.bd/products/2-i346215353.html,346215353,346215353_BD-1694244451,31.0,Premium,Low,2.4
Black Combo T-Shirts & Pants for Men - Stylish Matching Sets - Easy to Use And Maintain - Comfortable and Fashionable T-Shirts and Pants,Male,Black,Unknown,Unknown,Combo,272,19,2,Dhaka,www.daraz.com.bd/products/-i344000359.html,344000359,344000359_BD-1678237850,32.0,Premium,Low,6.333333333333333
Excellent Chinese Design Fashionable Full Sleeve Tshirt for Menz,Unknown,Unknown,Full Sleeve,Unknown,Unknown,120,93,10,Dhaka,www.daraz.com.bd/products/-i277201456.html,277201456,277201456_BD-1257148349,54.0,Medium,High,8.454545454545455
Manfare's Premium Solid T Shirt - Grey I,Unknown,Grey,Unknown,Unknown,Unknown,359,210,59,Dhaka,www.daraz.com.bd/products/manfare-i-i270523296.html,270523296,270523296_BD-1242222424,20.0,Premium,Low,3.5
Embrace Winter Vibes with Trendy Contrast Color Men's Full & Long Sleeve T-Shirts by Vantage - Stay Warm and Stylish Throughout the Chilly Season,Unknown,Unknown,Unknown,Unknown,Unknown,399,576,38,Dhaka,www.daraz.com.bd/products/embrace-winter-vibes-with-trendy-contrast-color-mens-full-long-sleeve-t-shirts-by-vantage-stay-warm-and-stylish-throughout-the-chilly-season-i231670520.html,231670520,231670520_BD-1174800111,39.0,Premium,Medium,14.76923076923077
Black  Colour Cotton short Sleeve Tshirt For Men,Male,Black,Short Sleeve,Cotton,Unknown,95,21,6,Dhaka,www.daraz.com.bd/products/-i216913196.html,216913196,216913196_BD-1165424908,62.0,Low,Very High,3.0
Winter New Cricket Test White Jersey - T Shirt For Man - T Shirt For Man - T Shirt,Male,White,Unknown,Unknown,Unknown,189,198,33,Dhaka,www.daraz.com.bd/products/winter-new-cricket-test-white-jersey-t-shirt-for-man-t-shirt-for-man-t-shirt-i216197777.html,216197777,216197777_BD-1822643097,58.0,High,Very High,5.823529411764706
Cotton Short Sleeve  T-Shirt For Man,Male,Unknown,Short Sleeve,Cotton,Unknown,98,41,3,Rangpur,www.daraz.com.bd/products/-i175938922.html,175938922,175938922_BD-1114926339,72.0,Low,Very High,10.25
New Fashion O-Neck Solid Men T-Shirt Casual Long Sleeve Slim Clothes Men Poly Cotton Tee Shirts - T Shirt For Man - T Shirt For Man,Male,Unknown,Unknown,Cotton,Unknown,125,131,15,Dhaka,www.daraz.com.bd/products/new-fashion-o-neck-solid-men-t-shirt-casual-long-sleeve-slim-clothes-men-poly-cotton-tee-shirts-t-shirt-for-man-t-shirt-for-man-i162774789.html,162774789,162774789_BD-1094980951,43.0,Medium,Medium,8.1875
Black Full Sleeve T Shirt For Men,Male,Black,Full Sleeve,Unknown,Unknown,158,7,1,Dhaka,www.daraz.com.bd/products/-i344755863.html,344755863,344755863_BD-1685175860,37.0,Medium,Low,3.5
Car R34 Premium Quality - Casual T Shirt // For Men T Shirt,Male,Unknown,Unknown,Unknown,Unknown,92,9,1,Dhaka,www.daraz.com.bd/products/r34-i336738628.html,336738628,336738628_BD-1640843650,46.0,Low,Medium,4.5
Athleisure - Avant Grade - Upscale Need - Short Sleeve T-Shirt For Mens - T Shirt For Man - Sensible - Must Have - Designed - Urban Vibes,Male,Unknown,Short Sleeve,Unknown,Unknown,173,66,16,Dhaka,www.daraz.com.bd/products/athleisure-avant-grade-upscale-need-short-sleeve-t-shirt-for-mens-t-shirt-for-man-sensible-must-have-designed-urban-vibes-i315621452.html,315621452,315621452_BD-1426579200,13.0,Medium,Low,3.8823529411764706
Versatile -Choice and Remark -Comfortable Trouser & T-Shirt Combo - T Shirt - T Shirt- Avant-garde Qualityful - Easy To care and Longive,Unknown,Unknown,Unknown,Unknown,Combo,550,95,14,Dhaka,www.daraz.com.bd/products/-i296026480.html,296026480,296026480_BD-1309908016,0.0,Premium,Low,6.333333333333333
New Styile Full Sleeve  black  t-shirt for Men,Male,Black,Full Sleeve,Unknown,Unknown,248,4400,376,Dhaka,www.daraz.com.bd/products/-i270702379.html,270702379,270702379_BD-1242382676,45.0,High,Medium,11.671087533156498
Alhamdulillah Printed Casual T-Shirt For Men - A Round Neck Casual Wear Reflecting Your Thankfulness and Style,Male,Unknown,Unknown,Unknown,Unknown,90,4200,474,Dhaka,www.daraz.com.bd/products/alhamdulillah-printed-casual-t-shirt-for-men-a-round-neck-casual-wear-reflecting-your-thankfulness-and-style-i270098683.html,270098683,270098683_BD-1241821637,55.0,Low,High,8.842105263157896
Premium t-Shirt for Men - fabric soft to wearing,Male,Unknown,Unknown,Unknown,Unknown,257,52,5,Dhaka,www.daraz.com.bd/products/-i238123088.html,238123088,238123088_BD-1830900416,60.0,High,Very High,8.666666666666666
Friends Forever Gol Gola Tshirt By Afia Garments,Unknown,Unknown,Unknown,Unknown,Unknown,115,38,4,Dhaka,www.daraz.com.bd/products/-i232870735.html,232870735,232870735_BD-1175625915,59.0,Medium,Very High,7.6
Black printed Exclusive Summer Combo T-Shirt & Pant,Unknown,Black,Unknown,Unknown,Combo,299,59,11,Dhaka,www.daraz.com.bd/products/-i229318610.html,229318610,229318610_BD-1172962996,50.0,Premium,Medium,4.916666666666667
Half Sleeve Chinese Printed Microfibre Tshirts for Women and girls,Female,Unknown,Half Sleeve,Unknown,Unknown,99,692,82,Dhaka,www.daraz.com.bd/products/-i320179253.html,320179253,320179253_BD-1638051716,51.0,Low,High,8.337349397590362
Black Cotton&Polyester T-Shirt For Men - T Shirt - T Shirt - T Shirt,Male,Black,Unknown,Cotton & Polyester,Unknown,199,521,36,Dhaka,www.daraz.com.bd/products/black-cottonpolyester-t-shirt-for-men-t-shirt-t-shirt-t-shirt-i228644688.html,228644688,228644688_BD-1172450522,50.0,High,Medium,14.08108108108108
Multicolor Cotton Stylish Short Sleeve T-Shirt For Men_TShirt For Man,Male,Multicolor,Short Sleeve,Cotton,Unknown,450,59,19,Dhaka,www.daraz.com.bd/products/_-i226395980.html,226395980,226395980_BD-1170962630,0.0,Premium,Low,2.95
New Full Sleeve Jarsey T-Shirt for Men - Comfortable and Stylish for Everyday Casual Wear,Male,Unknown,Full Sleeve,Unknown,Unknown,325,1700,335,Dhaka,www.daraz.com.bd/products/new-full-sleeve-jarsey-t-shirt-for-men-comfortable-and-stylish-for-everyday-casual-wear-i204223366.html,204223366,204223366_BD-1152897078,62.0,Premium,Very High,5.059523809523809
"Olive Cotton Short Sleeve T-Shirt for Men - Genji Inspired Fashion - Qualityful, Easy to Care, and Long-lasting",Male,Red,Short Sleeve,Cotton,Unknown,135,2100,213,Dhaka,www.daraz.com.bd/products/olive-cotton-short-sleeve-t-shirt-for-men-genji-inspired-fashion-qualityful-easy-to-care-and-long-lasting-i136864158.html,136864158,136864158_BD-1059072805,66.0,Medium,Very High,9.813084112149532
Exclusive New Stylish Combo T-Shirt & Full Pant,Unknown,Unknown,Unknown,Unknown,Combo,299,15,2,Dhaka,www.daraz.com.bd/products/-i326099111.html,326099111,326099111_BD-1570691835,69.0,Premium,Very High,5.0
Stylish - Modern Vibe - Highly Sustainable - Short Sleeve T-Shirt For Mens - T Shirt For Man - Durabilty Assured - Designed - Urban Vibes,Male,Red,Short Sleeve,Unknown,Unknown,257,12,3,Dhaka,www.daraz.com.bd/products/stylish-modern-vibe-highly-sustainable-short-sleeve-t-shirt-for-mens-t-shirt-for-man-durabilty-assured-designed-urban-vibes-i315052477.html,315052477,315052477_BD-1421075180,43.0,High,Medium,3.0
Short Sleeve T Shirt For Women,Female,Unknown,Short Sleeve,Unknown,Unknown,199,1500,206,Dhaka,www.daraz.com.bd/products/-i313986655.html,313986655,313986655_BD-1409410097,63.0,High,Very High,7.246376811594203
2024 New Excellent T-shirts Of Good Quality Men's half-sleeved T-shirts,Unknown,Unknown,Unknown,Unknown,Unknown,99,0,0,Dhaka,www.daraz.com.bd/products/2024-i367736944.html,367736944,367736944_BD-1835343981,50.0,Low,Medium,0.0
Trendy Stylish Fashion tops ladies short sleeve casual t-shirt for grail,Female,Unknown,Short Sleeve,Unknown,Unknown,199,28,4,Dhaka,www.daraz.com.bd/products/-i349931151.html,349931151,349931151_BD-1812645199,0.0,High,Low,5.6
Manfare's ðˆð¬ð¥ðšð¦ð¢ðœ ð‚ðšð¥ð¥ð¢ð ð«ðšð©ð¡ð² ð“-ð’ð¡ð¢ð«ð­ - MF-533,Unknown,Unknown,Unknown,Unknown,Unknown,427,158,35,Dhaka,www.daraz.com.bd/products/manfares-mf-533-i324444210.html,324444210,324444210_BD-1552791918,22.0,Premium,Low,4.388888888888889
Superlative Refined Taste -Indispensable -Upscale Living -Islamic casual T-shirt for men- Inventive Choice- Unique Inspiration,Unknown,Unknown,Unknown,Unknown,Unknown,88,871,81,Dhaka,www.daraz.com.bd/products/superlative-refined-taste-indispensable-upscale-living-islamic-casual-t-shirt-for-men-inventive-choice-unique-inspiration-i275021427.html,275021427,275021427_BD-1252256816,65.0,Low,Very High,10.621951219512194
Apna Time Ayega T-Shirt for Men,Male,Unknown,Unknown,Unknown,Unknown,110,15,1,Dhaka,www.daraz.com.bd/products/-i121292252.html,121292252,121292252_BD-1047600859,44.0,Medium,Medium,7.5
Star Smile t shirt for man| Half Sleeve genji for man,Male,Unknown,Half Sleeve,Unknown,Unknown,96,73,9,Dhaka,www.daraz.com.bd/products/-i362512484.html,362512484,362512484_BD-1788618622,52.0,Low,High,7.3
90's Premium Cotton Drop Shoulder T-shirt,Unknown,Unknown,Unknown,Cotton,Unknown,650,187,18,Dhaka,www.daraz.com.bd/products/90-i348861449.html,348861449,348861449_BD-1713581213,24.0,Premium,Low,9.842105263157896
Stylist T-Shirt For Summer - Tshirt For Men,Male,Unknown,Unknown,Unknown,Unknown,109,5,0,Dhaka,www.daraz.com.bd/products/-i355820328.html,355820328,355820328_BD-1750557070,45.0,Medium,Medium,5.0
Stylish Cotton Full Sleeve T-shirt For Men-Mangrove Fashion - T-Shirt For Men - T Shirt For Man - T Shirt For Man - T Shirt,Male,Unknown,Full Sleeve,Cotton,Unknown,182,20,3,Dhaka,www.daraz.com.bd/products/stylish-cotton-full-sleeve-t-shirt-for-men-mangrove-fashion-t-shirt-for-men-t-shirt-for-man-t-shirt-for-man-t-shirt-i267797738.html,267797738,267797738_BD-1239746077,54.0,High,High,5.0
Best quality Artcell casual  T-shirt for men,Male,Unknown,Unknown,Unknown,Unknown,88,152,19,Dhaka,www.daraz.com.bd/products/-i283545167.html,283545167,283545167_BD-1275903344,56.0,Low,High,7.6
Cotton High Quality half Sleeve t-shirt for men,Male,Unknown,Half Sleeve,Cotton,Unknown,131,0,0,Dhaka,www.daraz.com.bd/products/-i252013184.html,252013184,252013184_BD-1197443087,82.0,Medium,Very High,0.0
Black Combo  T-Shirt And 2 Quarter Pant For Men..,Unknown,Black,Unknown,Unknown,Combo,245,16,1,Dhaka,www.daraz.com.bd/products/2-i344118504.html,344118504,344118504_BD-1678517386,39.0,High,Medium,8.0
Primium plain T-Shirt For Man,Male,Unknown,Unknown,Unknown,Unknown,79,16,3,Dhaka,www.daraz.com.bd/products/-i248759420.html,248759420,248759420_BD-1195018289,47.0,Low,Medium,4.0
Sleeve-less Black T-shirt and 2 Quarter Pants for Man,Male,Black,Unknown,Unknown,Unknown,347,52,11,Dhaka,www.daraz.com.bd/products/2-i344450026.html,344450026,344450026_BD-1681850954,37.0,Premium,Low,4.333333333333333
White T-Shirt And 2 Quarter Pant For Men,Male,White,Unknown,Unknown,Unknown,271,20,2,Dhaka,www.daraz.com.bd/products/2-i346209600.html,346209600,346209600_BD-1694251364,32.0,High,Low,6.666666666666667
Cartoon Printed Casual T-Shirt for Men - Express Your Playful Style,Male,Unknown,Unknown,Unknown,Unknown,99,15,2,Dhaka,www.daraz.com.bd/products/cartoon-printed-casual-t-shirt-for-men-express-your-playful-style-i324189057.html,324189057,324189057_BD-1551959055,34.0,Low,Low,5.0
Full Sleeve T-Shirt For Men - Classic Style and Comfort Combined - 170+GSM - Best Attire For Mens - Perftect For All Season,Male,Unknown,Full Sleeve,Unknown,Unknown,230,242,30,Dhaka,www.daraz.com.bd/products/full-sleeve-t-shirt-for-men-classic-style-and-comfort-combined-170gsm-best-attire-for-mens-perftect-for-all-season-i276110926.html,276110926,276110926_BD-1254777939,54.0,High,High,7.806451612903226
New Bad&Dad Half Sleeve T-Shirt for Men - T Shirt - T Shirt,Male,Unknown,Half Sleeve,Unknown,Unknown,105,0,2,Dhaka,www.daraz.com.bd/products/new-baddad-half-sleeve-t-shirt-for-men-t-shirt-t-shirt-i251961902.html,251961902,251961902_BD-1197396564,45.0,Medium,Medium,0.0
Gray Cotton T-shirt For Men - T Shirt For Man - T Shirt For Man - T Shirt - T Shirt For Man - T Sirt,Male,Unknown,Unknown,Cotton,Unknown,155,61,6,Dhaka,www.daraz.com.bd/products/-i101238769.html,101238769,101238769_BD-1015228823,62.0,Medium,Very High,8.714285714285714
gorom Premium Quality - stylish new T Shirt - Casual Exclusive half Sleeve T Shirt For Men - T Shirt,Male,Unknown,Half Sleeve,Unknown,Unknown,92,6,0,Dhaka,www.daraz.com.bd/products/-i351436647.html,351436647,351436647_BD-1723649450,46.0,Low,Medium,6.0
Soft & Comfortable T-shirt For Men,Male,Unknown,Unknown,Unknown,Unknown,88,13,3,Dhaka,www.daraz.com.bd/products/-i343113368.html,343113368,343113368_BD-1673167746,58.0,Low,Very High,3.25
High Quality V Neck Half Sleeve  Cotton T-Shirt For Men'S - T Shirt - T Shirt,Unknown,Unknown,Half Sleeve,Cotton,Unknown,259,14,5,Dhaka,www.daraz.com.bd/products/high-quality-v-neck-half-sleeve-cotton-t-shirt-for-mens-t-shirt-t-shirt-i299785285.html,299785285,299785285_BD-1331816087,32.0,High,Low,2.3333333333333335
"""Comfortable T-Shirt & Pant Combo - (Set) For Man - Experience Comfort and Style with this Casual Combo.""",Male,Unknown,Unknown,Unknown,Combo,236,109,5,Dhaka,www.daraz.com.bd/products/comfortable-t-shirt-pant-combo-set-for-man-experience-comfort-and-style-with-this-casual-combo-i319510564.html,319510564,319510564_BD-1467607273,69.0,High,Very High,18.166666666666668
Balack  color printed stylish Cotton Full Sleeve T-Shirt for Men,Male,Unknown,Full Sleeve,Cotton,Unknown,264,152,5,Dhaka,www.daraz.com.bd/products/balove-i148780608.html,148780608,148780608_BD-1074936653,41.0,High,Medium,25.333333333333332
Black Printed Exclusive Summer Combo T-Shirt & Pant,Unknown,Black,Unknown,Unknown,Combo,280,18,4,Dhaka,www.daraz.com.bd/products/-i323049844.html,323049844,323049844_BD-1634745295,30.0,Premium,Low,3.6
Naruto Akatsuki  T-Shirt Black Cotton T-Shirt Anime Full170Gsm Cotton Banga Kun Shop - T-Shirt For Men - T Shirt,Male,Black,Unknown,Cotton,Unknown,385,122,24,Dhaka,www.daraz.com.bd/products/naruto-akatsuki-t-shirt-black-cotton-t-shirt-anime-full170gsm-cotton-banga-kun-shop-t-shirt-for-men-t-shirt-i303322588.html,303322588,303322588_BD-1351340418,0.0,Premium,Low,4.88
Pink Cotton Half Sleeve Premium T-Shirt For Women,Female,Pink,Half Sleeve,Cotton,Unknown,199,4100,596,Dhaka,www.daraz.com.bd/products/-i239778854.html,239778854,239778854_BD-1183182143,64.0,High,Very High,6.867671691792295
Cotton Solid Black Full Sleeve Tshirt for Winter by LEEBAS,Unknown,Black,Full Sleeve,Cotton,Unknown,325,1100,201,Dhaka,www.daraz.com.bd/products/cotton-solid-black-full-sleeve-tshirt-for-winter-by-leebas-i205598321.html,205598321,205598321_BD-1153954977,40.0,Premium,Medium,5.445544554455446
Premium Quality Soft & Comfortable Jersey Fabric Full Sleeve T-Shirt for Men - Ideal for All Seasons and Casual Wear,Male,Unknown,Full Sleeve,Unknown,Unknown,77,28,0,Dhaka,www.daraz.com.bd/products/-i364419189.html,364419189,364419189_BD-1808162668,47.0,Low,Medium,28.0
Navy Blue Full  Sleeve T Shirt For Men,Male,Blue,Unknown,Unknown,Unknown,250,1300,143,Dhaka,www.daraz.com.bd/products/-i276109784.html,276109784,276109784_BD-1254779026,50.0,High,Medium,9.027777777777779
Exclusive Fashionable t shirt for Men - Comfortable to wear,Male,Unknown,Unknown,Unknown,Unknown,197,4300,556,Dhaka,www.daraz.com.bd/products/-i215503858.html,215503858,215503858_BD-1164020506,74.0,High,Very High,7.719928186714542
new best Online: Buy T-Shirts For Men In Bangladesh,Male,Unknown,Unknown,Unknown,Unknown,96,0,1,Dhaka,www.daraz.com.bd/products/-i409903072.html,409903072,409903072_BD-2026237790,52.0,Low,High,0.0
T-shirt's for men Best Quality Casual,Male,Unknown,Unknown,Unknown,Unknown,96,33,9,Dhaka,www.daraz.com.bd/products/-i362514068.html,362514068,362514068_BD-1788605317,52.0,Low,High,3.3
Black Poly-Cotton Full  Sleeve T Shirt For Men,Male,Black,Unknown,Cotton,Unknown,240,0,3,Dhaka,www.daraz.com.bd/products/-i324583403.html,324583403,324583403_BD-1553386811,54.0,High,High,0.0
Texpark Solid T-Shirt - Black Half Sleeve Round Neck - Comfortable and Stylish Wear - Trendy Men's T Shirt Fashion,Unknown,Black,Half Sleeve,Unknown,Unknown,219,1400,213,Dhaka,www.daraz.com.bd/products/texpark-solid-t-shirt-black-half-sleeve-round-neck-comfortable-and-stylish-wear-trendy-mens-t-shirt-fashion-i275600768.html,275600768,275600768_BD-1253634317,37.0,High,Low,6.542056074766355
Khela Hobe Short Sleeve Printed T-Shirt - Genji,Unknown,Unknown,Short Sleeve,Unknown,Unknown,99,35,3,Dhaka,www.daraz.com.bd/products/khela-hobe-short-sleeve-printed-t-shirt-genji-i225895087.html,225895087,225895087_BD-1170759911,82.0,Low,Very High,8.75
White Comfortable Tshirt - T Shirt - T Shirt,Unknown,White,Unknown,Unknown,Unknown,125,64,6,Dhaka,www.daraz.com.bd/products/white-comfortable-tshirt-t-shirt-t-shirt-i129034077.html,129034077,129034077_BD-1048836073,64.0,Medium,Very High,9.142857142857142
Best Quality Casual à¦—à§‡à¦žà§à¦œà¦¿ à¦›à§‡à¦²à§‡à¦¦à§‡à¦° new tshirt | Half Sleeve genji for man,Male,Unknown,Half Sleeve,Unknown,Unknown,99,5,0,Dhaka,www.daraz.com.bd/products/-i409891289.html,409891289,409891289_BD-2026431757,50.0,Low,Medium,5.0
One Piece Monkey D Luffy Black Cotton Half Sleeve T-shirt for Men Luffy Tshirt for Anime fans,Male,Black,Half Sleeve,Cotton,Unknown,385,7,0,Dhaka,www.daraz.com.bd/products/-i366170927.html,366170927,366170927_BD-1825458732,0.0,Premium,Low,7.0
"Black Color T-Shirt And 2 Quarter Pant For Men,",Unknown,Black,Unknown,Unknown,Unknown,299,59,4,Dhaka,www.daraz.com.bd/products/2-i343979078.html,343979078,343979078_BD-1677699787,34.0,Premium,Low,11.8
New Degin Half Sleeve Jersey T-shirt for Men - Black & White,Male,Black & White,Half Sleeve,Unknown,Unknown,96,8,1,Dhaka,www.daraz.com.bd/products/-i339068637.html,339068637,339068637_BD-1660770276,52.0,Low,High,4.0
Full Sleeve T-Shirt new style for Men - T Shirt For Man - T Shirt For Man - T Shirt For Man,Male,Unknown,Full Sleeve,Unknown,Unknown,118,94,10,Dhaka,www.daraz.com.bd/products/full-sleeve-t-shirt-new-style-for-men-t-shirt-for-man-t-shirt-for-man-t-shirt-for-man-i280182449.html,280182449,280182449_BD-1266072758,66.0,Medium,Very High,8.545454545454545
White Color Motivational Short Sleeve Comfortable Jersey fabrics Tshirt,Unknown,White,Short Sleeve,Unknown,Unknown,114,155,23,Dhaka,www.daraz.com.bd/products/-i232536400.html,232536400,232536400_BD-1175372845,59.0,Medium,Very High,6.458333333333333
Fashionable T-shirt for men,Male,Unknown,Unknown,Unknown,Unknown,89,186,9,Dhaka,www.daraz.com.bd/products/-i338427060.html,338427060,338427060_BD-1653979490,56.0,Low,High,18.6
Full Sleeve Cotton T shirts for Women and girls - Comfortable jersey Solid Ladies t shirt Remarkable - Full Hata Cotton t-shirt for men,Male,Unknown,Full Sleeve,Cotton,Unknown,165,20,2,Dhaka,www.daraz.com.bd/products/-i324319434.html,324319434,324319434_BD-1552392231,70.0,Medium,Very High,6.666666666666667
Athleisure - Avant Grade - Highly Durable - Exclusive Sleeveless T-Shirt for Men - Sustainable Choice - Well Inspired & Crafted,Male,Red,Unknown,Unknown,Unknown,99,238,22,Dhaka,www.daraz.com.bd/products/-i306178479.html,306178479,306178479_BD-1368713946,60.0,Low,Very High,10.347826086956522
New Hot Collection Angelic T-shirt Angelic Pant (set) For Man,Male,Unknown,Unknown,Unknown,Unknown,171,150,6,Dhaka,www.daraz.com.bd/products/-i393975047.html,393975047,393975047_BD-1962305217,53.0,Medium,High,21.428571428571427
Pink  Cotton Printed Half Sleeve T-Shirt for Men,Male,Pink,Half Sleeve,Cotton,Unknown,299,5,1,Dhaka,www.daraz.com.bd/products/-i167720176.html,167720176,167720176_BD-1101528601,0.0,Premium,Low,2.5
Premium Quality - stylish new T Shirt - Casual Exclusive half Sleeve T Shirt For Men - T Shirt,Male,Unknown,Half Sleeve,Unknown,Unknown,90,38,0,Dhaka,www.daraz.com.bd/products/-i391441028.html,391441028,391441028_BD-1953138904,64.0,Low,Very High,38.0
Cotton short Sleeve t shirts for men- half sleeve round neck t shirt for men,Male,Unknown,Half Sleeve,Cotton,Unknown,211,19,0,Dhaka,www.daraz.com.bd/products/-i314043481.html,314043481,314043481_BD-1409643094,47.0,High,Medium,19.0
Navy Blue full  Sleeve T Shirt For Men - T Shirt,Male,Blue,Unknown,Unknown,Unknown,250,26,1,Dhaka,www.daraz.com.bd/products/-i324581122.html,324581122,324581122_BD-1553364190,44.0,High,Medium,13.0
Grey Men's Exclusive Summer Combo T-Shirt & Pant - T Shirt For Man - T Shirt For Man - T Shirt For Man,Male,Grey,Unknown,Unknown,Combo,354,18,2,Dhaka,www.daraz.com.bd/products/-i337581134.html,337581134,337581134_BD-1647033148,41.0,Premium,Medium,6.0
Tree Design Top Stylish t shirt for Men Comfortable and soft wear tee - new Design T Shirt For Man,Male,Unknown,Unknown,Unknown,Unknown,96,0,2,Dhaka,www.daraz.com.bd/products/-i367244665.html,367244665,367244665_BD-1830978793,52.0,Low,High,0.0
Cotton short Sleeve t shirts for men- half sleeve round neck t shirt for men,Male,Unknown,Half Sleeve,Cotton,Unknown,250,5,0,Dhaka,www.daraz.com.bd/products/-i314047294.html,314047294,314047294_BD-1409633586,37.0,High,Low,5.0
cotton women t-shirt -women tshirt,Female,Unknown,Unknown,Cotton,Unknown,189,26,3,Dhaka,www.daraz.com.bd/products/-i343771659.html,343771659,343771659_BD-1677016391,53.0,High,High,6.5
Navy Blue Premium Quality Full Sleeve T-Shirt for Men - Elevate Your Casual Style in Navy Blue,Male,Blue,Full Sleeve,Unknown,Unknown,211,12,4,Dhaka,www.daraz.com.bd/products/navy-blue-premium-quality-full-sleeve-t-shirt-for-men-elevate-your-casual-style-in-navy-blue-i325167887.html,325167887,325167887_BD-1559467180,65.0,High,Very High,2.4
MULTI COLOR COTTON SHORT SLEEVE SMART QUALITY T-SHART FOR MEN .,Male,Multicolor,Short Sleeve,Cotton,Unknown,146,77,8,Dhaka,www.daraz.com.bd/products/t-shart-i274611244.html,274611244,274611244_BD-1250517104,43.0,Medium,Medium,8.555555555555555
Black full sleeve cotton T shirt for men - T Shirt For Man - T Shirt For Man - T Shirt For Man,Male,Black,Full Sleeve,Cotton,Unknown,250,6,3,Dhaka,www.daraz.com.bd/products/black-full-sleeve-cotton-t-shirt-for-men-t-shirt-for-man-t-shirt-for-man-t-shirt-for-man-i275183007.html,275183007,275183007_BD-1252681648,50.0,High,Medium,1.5
Black & Cotton Combo T-Shirt & trouser Pant For Man,Male,Black,Unknown,Cotton,Combo,430,6,2,Dhaka,www.daraz.com.bd/products/-i300428793.html,300428793,300428793_BD-1334725036,28.0,Premium,Low,2.0
new Friendship  T shirt -Febric soft and comfortable to wear - T Shirt For Man,Male,Unknown,Unknown,Unknown,Unknown,96,717,52,Dhaka,www.daraz.com.bd/products/-i343512332.html,343512332,343512332_BD-1675127124,52.0,Low,High,13.528301886792454
Premium Quality Black Half Sleeve Cotton T-Shirt for Men Comfortable to Wear in All Seasons and Occasions,Male,Black,Half Sleeve,Cotton,Unknown,149,9,2,Dhaka,www.daraz.com.bd/products/-i348807145.html,348807145,348807145_BD-1713167727,57.0,Medium,High,3.0
"casual printed jersy tshirt for men's//black//white//maroon//navy//men's fashion//all is well brand//s,m,l,xl,xxl sizes//",Unknown,Black,Unknown,Unknown,Unknown,99,14,5,Dhaka,www.daraz.com.bd/products/all-is-well-brand-smlxlxxl-i384454206.html,384454206,384454206_BD-1922466477,50.0,Low,Medium,2.3333333333333335
It's A Beautiful Day To Leave Me Alone Letter Print T Shirt Women Short Sleeve O Neck Loose Tshirt Summer,Female,Unknown,Short Sleeve,Unknown,Unknown,114,59,7,Dhaka,www.daraz.com.bd/products/-i264276520.html,264276520,264276520_BD-1234691258,35.0,Medium,Low,7.375
Maroon Cotton Full Sleeve T-Shirt For Men,Male,Unknown,Full Sleeve,Cotton,Unknown,250,97,10,Dhaka,www.daraz.com.bd/products/-i144796780.html,144796780,144796780_BD-1069716767,50.0,High,Medium,8.818181818181818
premium quality t-shirt for men white colour,Male,White,Unknown,Unknown,Unknown,129,90,9,Dhaka,www.daraz.com.bd/products/-i348802749.html,348802749,348802749_BD-1713192635,48.0,Medium,Medium,9.0
BLACK COLOR COTTON Full Sleeve Round Neck CASUAL T-SHIRT FOR MEN - Comfortable and Stylish Wear,Male,Black,Full Sleeve,Cotton,Unknown,182,23,6,Dhaka,www.daraz.com.bd/products/-i287503574.html,287503574,287503574_BD-1287050674,39.0,High,Medium,3.2857142857142856
